id,handle,created_at,text,cleaned_text
1141517783714414592,kaylajdr,2019-06-20 01:27:02,"Fun fact: I loved Aladdin so much that in 8th grade, I sang* A Whole New World as my audition song for the Visual a… https://t.co/7tT9cfz3TM",fun fact loved aladdin much th grade sang whole new world audition song visual
1141516419382878208,wesigor,2019-06-20 01:21:37,sempre emocionado com a whole new world de aladdin,sempre emocionado com whole new world de aladdin
1141515608191885314,Dancerjenn,2019-06-20 01:18:23,They surprised me with this.... too frickin cute...💜💜💜💜💜💜💜💜💜💜💜💜💜 https://t.co/8ZYP9EoYAg,surprised frickin cute
1141509469937053696,Daniloreborn,2019-06-20 00:54:00,Aladdin - A Whole New World THE FART ALONG https://t.co/lXLxZ63kAU via @YouTube,aladdin whole new world fa along via
1141507548421513216,rockndawgclub,2019-06-20 00:46:22,"A Whole New World (Aladdin) - Cover (Fingerstyle Guitar) Andrew Foy https://t.co/CBBIVDxvai Subscribe, Comment &amp; Fo… https://t.co/V9SGjmR9Au",whole new world aladdin cover fingerstyle guitar andrew foy subscribe comment amp fo
1141507535071076352,DownatthePound,2019-06-20 00:46:19,"A Whole New World (Aladdin) - Cover (Fingerstyle Guitar) Andrew Foy https://t.co/a6CyA7L4a8 Subscribe, Comment &amp; Fo… https://t.co/FxurM82tPA",whole new world aladdin cover fingerstyle guitar andrew foy subscribe comment amp fo
1141506900237811712,fernivizcarra,2019-06-20 00:43:47,A whole new world es tan cuteeeee #Aladdin,whole new world es tan cuteeeee aladdin
1141506249579814913,NerdySnailie,2019-06-20 00:41:12,"😍😭🥺 what a gorgeous voice! His mother’s voice is magical 

Aladdin - A Whole New World (Mother/Son Duet)… https://t.co/cpyXafWFdB",gorgeous voice mothers voice magical aladdin whole new world motherson duet
1141505881949048837,sam_crouch20,2019-06-20 00:39:45,me and @ErikDTrick in the theater watching #Aladdin trying not to sing A Whole New World out loud https://t.co/Ca42GgeH1O,theater watching aladdin trying sing whole new world loud
1141504523476844545,AthenaGracePlay,2019-06-20 00:34:21,Aladdin - A Whole New World (Mother/Son Duet) https://t.co/kl49a9hWYQ via @YouTube WTF listen to this it’s amazing 😉 🔥😂🔥😂🔥❤️,aladdin whole new world motherson duet via wtf listen amazing
1141502921395322881,JazzyIncredible,2019-06-20 00:27:59,DISNEY SING-ALONGS | A Whole New World - Aladdin Lyric Video | Official ... https://t.co/GQqVu6ZTcO via @YouTube,disney singalongs whole new world aladdin lyric video official via
1141502422591787009,egxita,2019-06-20 00:26:00,"Here’s a song for you… A Whole New World (End Title) - From ""Aladdin"" by ZAYN
https://t.co/LhjqhuTaez",heres song whole new world end title aladdin zayn
1141501132004446208,AriTheZquadGod,2019-06-20 00:20:52,My Zquad ass sticking around for the end credits after Aladdin to record A Whole New World https://t.co/wISr7MOO8N,zquad ass sticking around end credits aladdin record whole new world
1141495983093821440,DamodarCinemas,2019-06-20 00:00:24,"A whole new world is waiting for you
Aladdin
(PG)
Village 6 - 2:40pm
Village 4 - 3:50pm https://t.co/iWywhfUYad",whole new world waiting youaladdinpgvillage pmvillage pm
1141492728544542721,abidabida_,2019-06-19 23:47:29,"Who wants to be my Aladdin? 
Show me a whole new fuxkin world",wants aladdin show whole new fuxkin world
1141488002675482624,VideoGamesC6,2019-06-19 23:28:42,"12- so goog by warpaint, speechless from Aladdin, doin time Lana's cover, a whole new world, nadir by tender",goog warpaint speechless aladdin doin time lanas cover whole new world nadir tender
1141487594330447872,neeyaqielah,2019-06-19 23:27:04,"✨ A Whole New World (End Title) - From ""Aladdin"" by ZAYN
https://t.co/MgFi2giLKr",whole new world end title aladdin zayn
1141478637251772417,huthuthutto,2019-06-19 22:51:29,Why am I singing Aladdin’s “A Whole New World” song?,singing aladdins whole new world song
1141477947406192641,fernandolar25,2019-06-19 22:48:44,Aladdin - A Whole New World [High Quality] https://t.co/CYA7Sx0hdK vía @YouTube,aladdin whole new world high quality va
1141477250048512000,0ru__ru0,2019-06-19 22:45:58,A Whole New World (Aladdin) - Nito https://t.co/uBwKB9Otl8 @YouTubeより,whole new world aladdin nito
1141477000642646016,centuryfinearts,2019-06-19 22:44:59,We are flying into a Whole New World with Aladdin!! So excited for these kids to not only learn acting and it's lin… https://t.co/h8MR456GZR,flying whole new world aladdin excited kids learn acting lin
1141474298818957317,fernandolar25,2019-06-19 22:34:15,"ZAYN, Zhavia Ward - A Whole New World (End Title) (From ""Aladdin"") https://t.co/wj3QfwJrtP vía @YouTube",zayn zhavia ward whole new world end title aladdin va
1141470863902019584,baahouston,2019-06-19 22:20:36,"A whole new world is only one week away! Disney's @aladdin , coming to the @HobbyCenter June 26-July 14. Get your t… https://t.co/NikDRs0ysg",whole new world one week away disneys coming june july get
1141466994367053824,Emi0304_lm,2019-06-19 22:05:13,@disneyaladdin Aladdin is the number 1 movie in Japan for 2nd weekend🧞‍♂️ thank you for show us a whole new world.… https://t.co/X7jy887ZBk,aladdin number movie japan nd weekend thank show us whole new world
1141458535601123331,ShanOfficially,2019-06-19 21:31:36,"The most beautiful rendition! Omg 

Aladdin - A Whole New World (Mother/Son Duet) https://t.co/qjgk9dsijN via @YouTube",beautiful rendition omg aladdin whole new world motherson duet via
1141457682915844098,brynnsediting,2019-06-19 21:28:13,"@melonzieglers also, a whole new world &amp; the aladdin soundtrack &gt;&gt; ur fav song",also whole new world amp aladdin soundtrack gtgt ur fav song
1141456528362262528,SarahSartell,2019-06-19 21:23:38,It’s been an amazing whole new world experiencing these incredible shows in London and I don’t want to stop🎭✨💛… https://t.co/Z9LtQYycdG,amazing whole new world experiencing incredible shows london dont want stop
1141451035262750721,Dalal_alm90,2019-06-19 21:01:48,A Whole New World #Aladdin⁠ ⁠⁠ ⁠🧞‍♂️🌎 https://t.co/z7dI5dQtSt,whole new world aladdin
1141450603052380160,zeeknd,2019-06-19 21:00:05,sat through all of aladdin only for the end title to be dj khaled obnoxiously yelling instead of A Whole New World.… https://t.co/hbRYweniBq,sat aladdin end title dj khaled obnoxiously yelling instead whole new world
1141449483659689985,PerilousPeanut,2019-06-19 20:55:38,"I can theorize just as desperately though

aladdin I guess is because aladdin and jasmine fly by greece during A Wh… https://t.co/o8liBXJgGj",theorize desperately thoughaladdin guess aladdin jasmine fly greece wh
1141448081520676864,knorsen,2019-06-19 20:50:04,"Let me share this whole new world with you! After seeing the new live action Aladdin, I had to create this beautifu… https://t.co/pucPX98xWA",let share whole new world seeing new live action aladdin create beautifu
1141447701181149184,giusyemme89,2019-06-19 20:48:33,A Whole New World(Music Video) - From ALADDIN https://t.co/CsmMnifQK2,whole new worldmusic video aladdin
1141446837024391168,jajdj89,2019-06-19 20:45:07,Aladdin - A Whole New World (Mother/Son Duet) https://t.co/jPIW0tFKZh via @YouTube   beautiful! ❤️,aladdin whole new world motherson duet via beautiful
1141440107196473345,PangLam19,2019-06-19 20:18:23,A Whole New World (End Title)[From Aladdin](From Aladdin) https://t.co/cxFI6DChAe https://t.co/JYdOOds7g4,whole new world end titlefrom aladdinfrom aladdin
1141438643556540416,Study_Breaks,2019-06-19 20:12:34,Actress @NaomiScott opens up Princess Jasmine and #Aladdin to a whole new world of female empowerment. https://t.co/QzkLCbiYhv,actress opens princess jasmine aladdin whole new world female empowerment
1141437972572704768,natusichka_91,2019-06-19 20:09:54,"Mena Massoud, Naomi Scott - A Whole New World (From ""Aladdin"") https://t.co/VHi7A9T3tK via @YouTube",mena massoud naomi scott whole new world aladdin via
1141436839468965890,DrJoker82,2019-06-19 20:05:24,A Whole New World (from Disney's Aladdin) Violin &amp; Piano Cover - Taylor ... https://t.co/GUcYa0whGh via @YouTube,whole new world disneys aladdin violin amp piano cover taylor via
1141431288357937152,ILuvMusik5,2019-06-19 19:43:20,“A Whole New World” (Aladdin) Arabic Cover by Robyn Adele Anderson ft. Adam Bastien https://t.co/EnGznntV5s https://t.co/HdDz3YnCPU,whole new world aladdin arabic cover robyn adele anderson ft adambastien
1141429759294881792,JackieeLen,2019-06-19 19:37:16,Aladdin - A Whole New World (Mother/Son Duet) https://t.co/i4aaAOriW7 via @YouTube,aladdin whole new world motherson duet via
1141428966567436288,DonnovanReed,2019-06-19 19:34:07,Aladdin - A Whole New World (Mother/Son Duet) https://t.co/tYRViwEuUb,aladdin whole new world motherson duet
1141427441929478145,vicky_garbarino,2019-06-19 19:28:03,@Nadia_Soy_Yo Un mundo ideal / A whole new world - Aladdin,soyyo un mundo ideal whole new world aladdin
1141424344700268546,Budda_Fly,2019-06-19 19:15:45,Aladdin - A Whole New World (Mother/Son Duet) https://t.co/oYTdI149Ot via @YouTube @IAmReginaBelle @PeaboBryson2… https://t.co/eCxJuA1WCe,aladdin whole new world motherson duet via
1141421350554341376,arliscoleman,2019-06-19 19:03:51,"Morissette, Darren Espanto perform ""A Whole New World (Aladdin's Theme)"" LIVE (REACTION)

https://t.co/OdoH8aLZtX",morissette darren espanto perform whole new world aladdins theme live reaction
1141417914328735744,syafieqasyeraf,2019-06-19 18:50:11,I can show u the world🌎✨ OST. Aladdin (A WHOLE NEW WORLD) https://t.co/Dknn8bhuNg,show u world ost aladdin whole new world
1141414765455011840,Wew18120790,2019-06-19 18:37:41,A Whole New World (End Title)[From Aladdin](From Aladdin) https://t.co/ORltyGcxMj https://t.co/iAtzEujNI1,whole new world end titlefrom aladdinfrom aladdin
1141405205545623552,nameIessme,2019-06-19 17:59:41,"Orang orang setelah Aladdin: a whole new world~

Aq: prince ali mighty is he ali ababwa!!",orang orang setelah aladdin whole new worldaq prince ali mighty ali ababwa
1141404187848110080,Toi14175798,2019-06-19 17:55:39,Whole New World_Aladdin https://t.co/96hxRqheD7 https://t.co/w3DGp89rUN,whole new worldaladdin
1141400714565959681,Beet30407953,2019-06-19 17:41:51,A Whole New World (End Title)[From Aladdin](From Aladdin) https://t.co/zkl1Q85qpz https://t.co/4cVqShRTEh,whole new world end titlefrom aladdinfrom aladdin
1141398706006007809,OOCS_LLC,2019-06-19 17:33:52,Aladdin was on point!!! Aianna told me to shut up and kicked me when I tried singing along to A Whole New World!!!😳… https://t.co/teFv0Hz2Ct,aladdin point aianna told shut kicked tried singing along whole new world
1141391308663115776,tagxhminhyun,2019-06-19 17:04:28,"Mena Massoud, Naomi Scott - A Whole New World (From ""Aladdin"") https://t.co/rQV82wpAO0 via @YouTube",mena massoud naomi scott whole new world aladdin via
1141389166548271107,prnceaIi,2019-06-19 16:55:57,"mena , naomi , &amp;’ darren singing a whole new world at the aladdin after party is the best thing you’ll see today https://t.co/Mvsy26HgaN",mena naomi amp darren singing whole new world aladdin pay best thing youll see today
1141389113125269504,Tockn_inthebox,2019-06-19 16:55:45,"A Whole New World (Aladdin) - Nito
https://t.co/Js3j18wUsI",whole new world aladdin nito
1141386334579220481,udonome007,2019-06-19 16:44:42,@JimKilbane Holy flying carpets Aladdin! It's a whole new world in there!,holy flying carpets aladdin whole new world
1141383399313219584,mdudabr2006,2019-06-19 16:33:02,"@shivanipaliwal Meu abrigo – Melim. 
Ouvi dizer – Melim. 
Speechless – [Naomi Scott] Aladdin.
A Whole New World. –… https://t.co/ObkNKF4aZB",meu abrigo melim ouvi dizer melim speechless naomi scott aladdina whole new world
1141383326923538432,__cumberbitch,2019-06-19 16:32:45,A Whole New World — Aladdin,whole new world aladdin
1141379022175141888,GyhaTheLast,2019-06-19 16:15:39,A whole new world cover with @ItsDanielCoz Aladdin 2019 https://t.co/1NsePMI05C,whole new world cover aladdin
1141374039539118080,TheMovieChaser,2019-06-19 15:55:51,"@ikkegoemikke When I flied at @Emirates there was a vast @Disney in-flight movie catalog there.

But there is no or… https://t.co/yU7FjXBXq5",flied vast inflight movie catalog therebut
1141370686474268674,lateefaboyabes,2019-06-19 15:42:31,A whole new world #Aladdin 🧞‍♂️📽 https://t.co/Fdu5t0rQNC,whole new world aladdin
1141370039590969344,YanyBebo_48,2019-06-19 15:39:57,"Celana #aladdin my fav💃
Suka dgn lirik lagu yg part bernada : 
A whole new world
Don't you dare close your eyes
A h… https://t.co/Nbg5ofu0i6",celana aladdin favsuka dgn lirik lagu yg pa bernada whole new worlddont dare close eyesa h
1141366675679244289,Tingtin01450239,2019-06-19 15:26:35,A Whole New World (End Title)[From Aladdin](From Aladdin) https://t.co/4kGFYttdmZ https://t.co/GV8TxxbHFT,whole new world end titlefrom aladdinfrom aladdin
1141365981542932480,Namking37111789,2019-06-19 15:23:50,A Whole New World (End Title)[From Aladdin](From Aladdin) https://t.co/93s4o9FX7n https://t.co/cZXGpMzxIs,whole new world end titlefrom aladdinfrom aladdin
1141358421674876928,yoonouhs,2019-06-19 14:53:47,"no one:
me: j-jaehyun whole new world cover because he is not just aladdin, he’s not A disney prince, he is The dis… https://t.co/SKO7nTYwvT",oneme jjaehyun whole new world cover aladdin hes disney prince dis
1141352029152923649,ESchinfeld,2019-06-19 14:28:23,"@scorebecca If you think that’s bad, don’t listen to the EDM version of A Whole New World from the new Will Smith Aladdin movie...",think thats bad dont listen edm version whole new world new smith aladdin movie
1141346012352544768,ruwanndp,2019-06-19 14:04:29,A Whole New World Song Scene - #Aladdin #movie https://t.co/IbiscHwqGP,whole new world song scene aladdin movie
1141344757245009921,artiques16,2019-06-19 13:59:29,"Exploring a whole new world 😁✨

#handmade #Art #AladdinMovie #Aladdin2019 #aladdin @HandmadeHour @disneyaladdin https://t.co/c9qSSbagMm",exploring whole new world handmade aladdinmovie aladdin aladdin
1141344734495019008,MelissaLlado,2019-06-19 13:59:24,It's a whole new world with this adorbs Team Jasmine shirt!  Show your love of Aladdin with this fun https://t.co/9cxsU1p2JG,whole new world adorbs team jasmine shi show love aladdin fun
1141344207467978757,_hahayahya,2019-06-19 13:57:18,"The Aladdin story aside, the songs, specifically Arabian Nights and A Whole New World took me back to the Malam Gal… https://t.co/MVU7zMIYI6",aladdin story aside songs specifically arabian nights whole new world took back malam gal
1141342055689531392,heartfeItdjh,2019-06-19 13:48:45,remember how dan and phil used to sing a whole new world from aladdin? you could say phil did show dan a whole new… https://t.co/DlGTqcRLbA,remember dan phil used sing whole new world aladdin could say phil show dan whole new
1141341053808590849,Tonkra91877616,2019-06-19 13:44:46,A Whole New World (End Title)[From Aladdin](From Aladdin) https://t.co/Oj6NZmB3wM https://t.co/wIfNAFSMaK,whole new world end titlefrom aladdinfrom aladdin
1141341026277138432,Tonkra91877616,2019-06-19 13:44:40,A Whole New World (End Title)[From Aladdin](From Aladdin) https://t.co/Oj6NZmB3wM https://t.co/HFNUawdO7y,whole new world end titlefrom aladdinfrom aladdin
1141340859222364161,JaMonkey,2019-06-19 13:44:00,Aladdin Toys For A Whole New World Of Fun! via @ThatAshleyErin https://t.co/CgH3EK7wMG,aladdin toys whole new world fun via
1141340810668994565,10riridk0,2019-06-19 13:43:49,"Mena Massoud, Naomi Scott - A Whole New World (From ""Aladdin"") https://t.co/0zkcIAvVRF @YouTubeより",mena massoud naomi scott whole new world aladdin
1141340534121910274,raiya89635586,2019-06-19 13:42:43,"Mena Massoud, Naomi Scott - A Whole New World (From ""Aladdin"") https://t.co/nnX33J6Ajr via @YouTube",mena massoud naomi scott whole new world aladdin via
1141338782798512128,Jairak7,2019-06-19 13:35:45,A Whole New World (End Title)[From Aladdin](From Aladdin) https://t.co/F1qITGmTHa https://t.co/3BPcqfRBCo,whole new world end titlefrom aladdinfrom aladdin
1141332804648652801,leastimnotfugly,2019-06-19 13:12:00,@bellathorne @WhoopiGoldberg For any other audiophiles out there hearing the similar melody between this Soapdish c… https://t.co/DKqalPgrII,audiophiles hearing similar melody soapdish c
1141317278253760512,aiph_daice,2019-06-19 12:10:18,@nnandaisuki @LayanYudai A WHOLE NEW WORLD and INTO YOU are freakin' famous songs... That's Aladdin and Ariana Gran… https://t.co/IkaeadAlLp,whole new world freakin famous songs thats aladdin ariana gran
1141317140936478720,GudetamaDaily,2019-06-19 12:09:45,"Forgot to add:

✔️A total disney prince

Try to watch his version of Disney's Aladdin, ""A whole New World"" with ex… https://t.co/fUNC0Uaq4p",forgot adda total disney princetry watch version disneys aladdin whole new world ex
1141315725228834816,JazzminSanch,2019-06-19 12:04:08,"MAY BAGO HO AKONG BIDYU!!! 
A Whole New World (From ""Aladdin"") Dance Cover
Video Link: https://t.co/NEsLRb9vOx 🌏✨ https://t.co/DZfYgjq6gW",may bago ho akong bidyu whole new world aladdin dance covervideo link
1141315117650309120,V1SHAL_IN,2019-06-19 12:01:43,"Listening to #Disney's ""A Whole New World..."" from #Aladdin",listening disneys whole new world aladdin
1141314760010543104,MikeCalvertToy,2019-06-19 12:00:18,Secure your tickets while they last and get ready to discover a whole new world at this Memorial Hermann Broadway s… https://t.co/IFft7D4SGh,secure tickets last get ready discover whole new world memorial hermann broadway
1141314708303048706,kpwxjn,2019-06-19 12:00:05,Aladdin - A Whole New World (Mother/Son Duet) https://t.co/d1HJCcifHf via @YouTube,aladdin whole new world motherson duet via
1141310414803939329,GRNDMSTRCaeFoo,2019-06-19 11:43:02,Grandmaster CaeFoo - Whole New World / #Aladdin #Vibe #Ridin #Music #HipHop #Rap #Trap #Detroit #Dearborn #Egypt… https://t.co/gbAPyMMIph,grandmaster caefoo whole new world aladdin vibe ridin music hiphop rap trap detroit dearborn egypt
1141305851765936128,littleuzma,2019-06-19 11:24:54,My mine right now. * a whole new world............*ost aladdin. :(,mine right whole new worldost aladdin
1141304217560207366,ljm530,2019-06-19 11:18:24,"Mena Massoud, Naomi Scott - A Whole New World (From ""Aladdin"") https://t.co/xEcNO73aNY - @YouTube",mena massoud naomi scott whole new world aladdin
1141298334663159808,LiNKQ8,2019-06-19 10:55:01,"Aladdin - A whole new world
1992 &gt; 2019",aladdin whole new world gt
1141297481419902976,tamimaaaay,2019-06-19 10:51:38,"Mena Massoud, Naomi Scott - A Whole New World (From ""Aladdin"") https://t.co/dbiNhUAXCE via @YouTube",mena massoud naomi scott whole new world aladdin via
1141296085006028800,kseungmsk,2019-06-19 10:46:05,@skzhyvnjln @yenskz Aladdin? A whole new world~,aladdin whole new world
1141295077278412800,theyaremysmile3,2019-06-19 10:42:05,Un mundo ideal / A whole new world 🗺 🌏 💕🙈 @zaynmalik #Aladdin #Unmundoideal #awholenewworld #ZaynMalik #Liampayne… https://t.co/ipB4ET4swe,un mundo ideal whole new world aladdin unmundoideal awholenewworld zaynmalik liampayne
1141293506238877696,Moay38231392,2019-06-19 10:35:50,A Whole New World (End Title)[From Aladdin](From Aladdin) https://t.co/SfdGbHhm3A https://t.co/3TypFWYr0j,whole new world end titlefrom aladdinfrom aladdin
1141285728820682752,Rammsoo,2019-06-19 10:04:56,"Aladdin: A whole new world
Red Velvet: Zimzalabim",aladdin whole new worldred velvet zimzalabim
1141285330890440706,orjiom,2019-06-19 10:03:21,"#aladdin #jasmine
A whole new world✨ https://t.co/9HBQJguYTL",aladdin jasminea whole new world
1141277115054039040,Ah_nonoh,2019-06-19 09:30:42,"ZAYN, Zhavia Ward - A Whole New World (End Title) (From ""Aladdin"") https://t.co/EiJlKo8wLp ข้อมูลจาก @YouTube",zayn zhavia ward whole new world end title aladdin
1141276644654452736,MustofaBasri23,2019-06-19 09:28:50,"I cant get enough of this! ZAYN, Zhavia Ward - A Whole New World (End Title) (From ""Aladdin"") https://t.co/n6o4fO4Rvw",cant get enough zayn zhavia ward whole new world end title aladdin
1141263228355219456,spearbeef,2019-06-19 08:35:31,"@Stray_Kids felix do u want to be my aladdin? so i can fly to a whole new world with u !♡😥😥😥
#StrayKidsComeback… https://t.co/ua96sVxLaG",kids felix u want aladdin fly whole new world u straykidscomeback
1141262366052499456,themhazelnut,2019-06-19 08:32:06,"“Tell me princess when did you last let your heart decide?”

dat line from A Whole New World always makes me go emo… https://t.co/yS1w8aJBA3",tell princess last let hea decidedat line whole new world always makes go emo
1141260974902534145,anyeongpipol,2019-06-19 08:26:34,"a whole new world
Felix do you want to be my aladdin?
😍😭 @Stray_Kids #StrayKidsComeback",whole new worldfelix want aladdin kids straykidscomeback
1141259878293561344,weenapie,2019-06-19 08:22:13,"Mena Massoud, Naomi Scott - A Whole New World (From ""Aladdin"") https://t.co/XlP6T4YF0b via @YouTube",mena massoud naomi scott whole new world aladdin via
1141245845494366208,maylaymg14,2019-06-19 07:26:27,@BTS_twt please do a cover song A Whole New World OST of Aladdin my best vocal lines💝💝💝💜💜💜💜😘😘😘👏👏👏,twt please cover song whole new world ost aladdin best vocal lines
1141244488062365697,JohnBaldwin64,2019-06-19 07:21:03,“A Whole New World” (Aladdin) Arabic Cover by Robyn Adele Anderson ft. Adam Bastien https://t.co/hnTiMTeru4 via @YouTube,whole new world aladdin arabic cover robyn adele anderson ft adam bastien via
1141241129158889472,hariandiri,2019-06-19 07:07:43,"Mena Massoud, Naomi Scott - A Whole New World (From ""Aladdin"") https://t.co/c63yLIbM5s lewat @YouTube",mena massoud naomi scott whole new world aladdin lewat
1141237842842193920,GEISHAVAMPIRESA,2019-06-19 06:54:39,All I can say is wao!!! Aladdin - A Whole New World (Mother/Son Duet) https://t.co/F9HTFANioP via @YouTube,say wao aladdin whole new world motherson duet via
1141237679943815168,Kargun00,2019-06-19 06:54:00,“A Whole New World” (Aladdin) Arabic Cover by Robyn Adele Anderson ft. A... https://t.co/sUPw1Cb26U vía @YouTube,whole new world aladdin arabic cover robyn adele anderson ft va
1141237593138442240,primaradiosby_,2019-06-19 06:53:40,#1038fm #nowplaying A Whole New World (Aladdin's Theme) (92) - Regina Belle &amp; Peabo Bryson | streaming klik… https://t.co/bX2QAco2k6,fm nowplaying whole new world aladdins theme regina belle amp peabo bryson streaming klik
1141229722652725248,uangthruhuy,2019-06-19 06:22:23,"@askmenfess Magic hour (magic hour)
I c the light (tangled)
A whole new world (aladdin)
Let it go (frozen)
Hakuna matata(?) (Lion king)",magic hour magic houri c light tangleda whole new world aladdinlet go frozenhakuna matata lion king
1141226402181632000,francisluisc,2019-06-19 06:09:11,A Whole New World | Aladdin OST | (Cover) Raphiel Shannon,whole new world aladdin ost cover raphiel shannon
1141220093822509056,zharifsadan,2019-06-19 05:44:07,"A WHOLE NEW WORLD // Aladdin🔮✨
-
Fuhh dah lama tak post cover. Kita start balik slow2😝 Terimalah, ""A Whole New Worl… https://t.co/eSeXKe9XOM",whole new world aladdinfuhh dah lama tak post cover kita sta balik slow terimalah whole new worl
1141217136968253440,kaizerk808,2019-06-19 05:32:22,Gonna see dat whole new world #Aladdin,gonna see dat whole new world aladdin
1141216250124627969,thebirdnard,2019-06-19 05:28:51,"A Whole New World-(Aladdin)
😀😀😀😀 https://t.co/I2OtPy8fas",whole new worldaladdin
1141214378299142146,MPRADIO_NET,2019-06-19 05:21:25,A Whole New World (From Aladdin) - ZAYN &amp; Zhavia Ward #Radio #Music #Live #NP #HipHop #Pop #Rap https://t.co/mVujHDtFm1,whole new world aladdin zayn amp zhavia ward radio music live np hiphop pop rap
1141210582520963072,vWaOgou2Zkmy00E,2019-06-19 05:06:20,A Whole New World (End Title)[From Aladdin](From Aladdin) https://t.co/A4tv4kejta https://t.co/jIJRaW2YEr,whole new world end titlefrom aladdinfrom aladdin
1141204229094289408,DeidraSaltsman,2019-06-19 04:41:05,"Mena Massoud, Naomi Scott - A Whole New World (From ""Aladdin"") https://t.co/DXcrx83Co8",mena massoud naomi scott whole new world aladdin
1141199923565608961,Maxine_122398,2019-06-19 04:23:58,"Literally saw this tweet while playing ""A Whole New World"" #Aladdin https://t.co/Gn2Wow6A9I",literally saw tweet playing whole new world aladdin
1141198289162817536,Zenazetira1,2019-06-19 04:17:29,Aladdin - A Whole New World (Mother/Son Duet) https://t.co/zpIabSSETx via @YouTube . MOM AND SON GOALS &lt;3,aladdin whole new world motherson duet via mom son goals lt
1141190057987997696,moshi_moshi_glb,2019-06-19 03:44:46,"【FOOD】Discover A Whole New World of Exotic Flavours with Ginza Cosy Corner's #Aladdin Petit #cake Set🍰

English:… https://t.co/e58qwWh0No",fooddiscover whole new world exotic flavours ginza cosy corners aladdin petit cake setenglish
1141187392323428353,yousefehab118,2019-06-19 03:34:11,"A whole new world 😍❤️
A new fantastic point of view 🧞‍♂️✨ - يشاهد Aladdin",whole new world new fantastic point view aladdin
1141186685390032896,ikakusuma_,2019-06-19 03:31:22,"Virus Aladdin 🎵 A Whole New World 🎵
💚
#JAEHYUN
#NCT127
#NCT
https://t.co/bOfoVFdCxO",virus aladdin whole new world jaehyunnctnct
1141186155985195009,delaneyoertly,2019-06-19 03:29:16,Today I asked Julie how “A Whole New World” from Aladdin went and she (no lie) started singing “Pure Imagination” f… https://t.co/3VSCJdioAT,today asked julie whole new world aladdin went lie staed singing pure imagination f
1141183351534919680,morena063,2019-06-19 03:18:07,"Here’s a song for you… A Whole New World - From ""Aladdin"" by Darren Espanto
https://t.co/Fp5Tb5yAle",heres song whole new world aladdin darren espanto
